### ISSUE TITLE
localhost時のコンテナネットワーク

### ISSUE THREAD

**Issue by GitEngHar** [GitEngHar/GrowTheLatestTechnorogy#16]
### 何でやるのか
- (http)127.0.0.1:8080:80 がコンテナに到達する経路を明示的にするため
  - Docker構成が現時点では漠然的なため、システム導入の際にしておく必要がある　  

### 何をやるのか
-  (http)127.0.0.1:8080:80 がコンテナに到達する経路を調べる。

### 理想の状態
-  (http)127.0.0.1:8080:80 がコンテナに到達する経路がわかる状態。

**Comment by GitEngHar** [comment]
役立ちそうな記事たち

localhost時のネットワークエラー
https://qiita.com/amuyikam/items/01a8c16e3ddbcc734a46

公式Dockerネットワーク
https://docs.docker.jp/v1.10/engine/userguide/networking/dockernetworks.html

**Comment by GitEngHar** [comment]
tracerouteでは経路を終えなかったためdockerコンポーネントを明らかにしていく
現在のdocker ネットワークコンポーネント
```
 $ docker network ls
NETWORK ID     NAME      DRIVER    SCOPE
846fe72301a6   bridge    bridge    local
996365c99988   host      host      local
fe5b30842c85   none      null      local
```

**Comment by GitEngHar** [comment]
懸念点

- 127.0.0.1では経路を終えなかった
    - 疎通で通っているnetworkを可視化できない場合証明が難しいと感じる
    - 127.0.0.1以外のlocalアドレスで検証もありか   
- 通信をdumpして確認するか

**Comment by GitEngHar** [comment]
tcp dumpでcurlのパケットを取得

データ種類

 localhost.38332からlocalhosthttp-altにデータ転送されている
http-altはIANAで登録されている8080のport名。httpサービスの代替port。


```

haru@TABLET-6SN5O8ET:~$ sudo tcpdump -i lo
tcpdump: verbose output suppressed, use -v or -vv for full protocol decode
listening on lo, link-type EN10MB (Ethernet), capture size 262144 bytes

### 3wayハンドシェイク
07:38:55.896594 IP localhost.38332 > localhost.http-alt: Flags [S], seq 20266503, win 65495, options [mss 65495,sackOK,TS val 3471376767 ecr 0,nop,wscale 7], length 0
07:38:55.896676 IP localhost.http-alt > localhost.38332: Flags [S.], seq 633935316, ack 20266504, win 65483, options [mss 65495,sackOK,TS val 3471376767 ecr 3471376767,nop,wscale 7], length 0
07:38:55.896707 IP localhost.38332 > localhost.http-alt: Flags [.], ack 1, win 512, options [nop,nop,TS val 3471376767 ecr 3471376767], length 0

### データの中身
07:38:55.897815 IP localhost.38332 > localhost.http-alt: Flags [P.], seq 1:79, ack 1, win 512, options [nop,nop,TS val 3471376768 ecr 3471376767], length 78: HTTP: GET / HTTP/1.1
07:38:55.897904 IP localhost.http-alt > localhost.38332: Flags [.], ack 79, win 511, options [nop,nop,TS val 3471376768 ecr 3471376768], length 0
07:38:55.903406 IP localhost.http-alt > localhost.38332: Flags [P.], seq 1:271, ack 79, win 512, options [nop,nop,TS val 3471376774 ecr 3471376768], length 270: HTTP: HTTP/1.1 200 OK
07:38:55.903472 IP localhost.38332 > localhost.http-alt: Flags [.], ack 271, win 510, options [nop,nop,TS val 3471376774 ecr 3471376774], length 0

### コネクションのクローズ
07:38:55.904029 IP localhost.38332 > localhost.http-alt: Flags [F.], seq 79, ack 271, win 512, options [nop,nop,TS val 3471376774 ecr 3471376774], length 0
07:38:55.905213 IP localhost.http-alt > localhost.38332: Flags [F.], seq 271, ack 80, win 512, options [nop,nop,TS val 3471376775 ecr 3471376774], length 0
07:38:55.905242 IP localhost.38332 > localhost.http-alt: Flags [.], ack 272, win 512, options [nop,nop,TS val 3471376775 ecr 3471376775], length 0
```

**Comment by GitEngHar** [comment]
https://www.kaitoy.xyz/2015/07/25/how-to-capture-packets-on-a-local-network-with-pcap4j-container/
日立のエンジニアの方のブログ
docker networkの記述があった。
それを元に検証しているブログ
https://christina04.hatenablog.com/entry/2016/07/22/193000

この２つからdocker networkの概要がつかめそう

**Comment by GitEngHar** [comment]
木： 作業してdocker networkについて理解する
金： @maco1222 へ再現をお願いする
土日： 達成できたのかをレビュー
月: 発表用できるように情報を集約する

**Comment by GitEngHar** [comment]
時間あればdocker dnsが既存コンポーネントとして立っていなそうなので、dnsについてもやっていきたい

**Comment by GitEngHar** [comment]
ここまでのまとめ
---

- 試したこと
  - traceroute 
  - [tcpdump](https://github.com/GitEngHar/GrowTheLatestTechnorogy/issues/16#issuecomment-1513873090)
  - wireshark
    - [ssdp](https://wa3.i-3-i.info/word12619.html)しか検知できず 
      - 欲しいログとは別のもの 
<img width="714" alt="image" src="https://user-images.githubusercontent.com/119464648/233743586-6082a873-360e-423e-84dc-605433aeab51.png">

**Comment by GitEngHar** [comment]
想定としては以下の裏付けがしたい

- windwosからwsl interfaceへパケットを流す
- wslからdocker bridgeへパケットを流す
- コンテナに到達にresponseを返す

wsl interfaceをdumpしても結果は得られなかったことから、おそらくwsl interfaceを介さず通信しているように思える
ローカルに対するリクエストの為パケットキャプチャや追跡がややこしくなっている。

公式のDockerネットワークの情報を元に現在のネットワークを紐解いていきたい。
- 通信経路を記す
- 各コンポーネントの実態とログを追跡する

**Comment by GitEngHar** [comment]
Docker Networkについてまとめる
---

- 何のためにあるのか
  - アプリケーション環境の分離・管理

- 初期状態
  - 3つのnetworkが作成される 
```
NETWORK ID          NAME                DRIVER
7fca4eb8c647        bridge              bridge
9f904ee27bf5        none                null
cf03ee007fb4        host                host
``` 

- 機能
  -  ` docker run --net=<ネットワーク名> ` を指定しないとdocker0に配置される
  -  [linuxをdocker hostとした場合 ` ifconfig ` でブリッジ見れる](https://tinyurl.com/w9unw2v7)
  - none interfaceはコンテナのネットワーク機能を無効にする
    - コンテナをdocker ローカルにとどめる 

- 設定方法
  - 起動時に--netで設定
  - bridge はコマンドで量産可能 


container調査用コマンド導入
```
apt update

apt-get install iputils-ping net-tools
```

調査系コマンドで便利
https://trios.pro/docker-tips-network-command/

**Comment by GitEngHar** [comment]
コンテナから外部への通信
---

実験するコンテナ(nginx)

<details>

```
CONTAINER ID   IMAGE     COMMAND                  CREATED       STATUS          PORTS                  NAMES
b395e19958cf   httpd     "httpd-foreground"       2 hours ago   Up 2 hours      0.0.0.0:8080->80/tcp   inspiring_wilson
ea3711f2dce8   nginx     "/docker-entrypoint.…"   2 hours ago   Up 17 minutes   0.0.0.0:8000->80/tcp   festive_noether
```

</details>


コンテナのip addressを確認

<details>

```
haru@TABLET-6SN5O8ET:~$ docker inspect --format='{{range .NetworkSettings.Networks}}{{.IPAddress}}{{end}}' ea3711f2dce8
172.17.0.2
```

</details>


containerのdns向き先を確認

<details>

```
root@ea3711f2dce8:/# cat /etc/resolv.conf
# DNS requests are forwarded to the host. DHCP DNS options are ignored.
nameserver 192.168.65.7
```

</details>


google.com の名前解決

<details>

```
traceroute to google.com (142.251.42.206), 30 hops max, 60 byte packets
 1  172.17.0.1 (172.17.0.1)  0.345 ms  0.300 ms  0.287 ms
 2  192.168.65.5 (192.168.65.5)  0.277 ms  0.244 ms  0.230 ms
 3  * * *
 4  * * *
 5  * * *
 6  * * *
 7  * * *
 8  * * *
 9  * * *
10  142.251.42.206 (142.251.42.206)  25.776 ms  26.557 ms  27.623 ms
```

</details>


bridge情報を確認

<details>

```
haru@TABLET-6SN5O8ET:~$ docker network inspect bridge
[
    {
        "Name": "bridge",
        "Id": "0250808df9fd050c342c30e5ef5bfc1a3faae0721acad98641982140866a6f70",
        "Created": "2023-04-20T22:43:12.0666245Z",
        "Scope": "local",
        "Driver": "bridge",
        "EnableIPv6": false,
        "IPAM": {
            "Driver": "default",
            "Options": null,
            "Config": [
                {
                    "Subnet": "172.17.0.0/16",
                    "Gateway": "172.17.0.1"
                }
            ]
        },
        "Internal": false,
        "Attachable": false,
        "Ingress": false,
        "ConfigFrom": {
            "Network": ""
        },
        "ConfigOnly": false,
        "Containers": {
            "b395e19958cf143ff5f064d689507d9e7380c260b2db8390fcf8b3ed40b52cce": {
                "Name": "inspiring_wilson",
                "EndpointID": "496969ee5c50d620880cae4a97d2e374a6802cc63c9ce8dc2205b2a2622a3e9d",
                "MacAddress": "02:42:ac:11:00:03",
                "IPv4Address": "172.17.0.3/16",
                "IPv6Address": ""
            },
            "ea3711f2dce8faf648eadcc5d504c5d609744dfe2dcf83c863afe47df15467c4": {
                "Name": "festive_noether",
                "EndpointID": "9c2565b0cd178ae2a38051a826b0343321b871c61b4631ff3ada48951c0ce6ef",
                "MacAddress": "02:42:ac:11:00:02",
                "IPv4Address": "172.17.0.2/16",
                "IPv6Address": ""
            }
        },
        "Options": {
            "com.docker.network.bridge.default_bridge": "true",
            "com.docker.network.bridge.enable_icc": "true",
            "com.docker.network.bridge.enable_ip_masquerade": "true",
            "com.docker.network.bridge.host_binding_ipv4": "0.0.0.0",
            "com.docker.network.bridge.name": "docker0",
            "com.docker.network.driver.mtu": "1500"
        },
        "Labels": {}
    }
]
```

</details>

**Comment by GitEngHar** [comment]
まとめ
---

- わかったこと
  - docker containerはdocker bridgeを経由してリクエストを受信する
  - docker bridgeはlnux host上で確認できる
    - linux からデフォルト構成のdockerにて通過するコンポーネントが docker bridgeかと思われる
  - 以上よりdockerネットワーク構成は以下といえる
    - host linux  →  docker bridge → container
    - ちなみにコンテナ同士はブリッジを介して通信が実現している
      - 名前解決をする場合は linkオプションでcontainerに対して名前解決の設定を付与する必要がある 
- 疑問点
  - containerからdnsへの通信
    -  etc/resolv.confに設定のあるaddressに解決が行くはずだが行かない
    - 公式にもhostsに設定のあるアドレスに解決が行くとあるが
  - [dockerのdnsはdaemon内部にある機能](https://tinyurl.com/yck3brx7)であるとのこと
    - daemonにアドレスふられてる？？
    - 詳しくは調べていない
    - 参考になりそう
      - https://dev.classmethod.jp/articles/docker-service-discovery/ 

localhostはdumpできないのでその場合の構成は控える。
サーバにリクエストが来た際の通路は明らかにできたが、そのパケットがどのように裁かれるのかはまだ調べていない
が、通信経路を明らかにする目標は達成できたと思われる

**Comment by GitEngHar** [comment]
nsswitchでhostが最初に向いているか確認していなかった

**Comment by GitEngHar** [comment]
nssswitch確認

```

haru@TABLET-6SN5O8ET:~$ docker exec -it b395e19958cf /bin/bash
root@b395e19958cf:/usr/local/apache2# cat /etc/nsswitch.conf
# /etc/nsswitch.conf
#
# Example configuration of GNU Name Service Switch functionality.
# If you have the `glibc-doc-reference' and `info' packages installed, try:
# `info libc "Name Service Switch"' for information about this file.

passwd:         files
group:          files
shadow:         files
gshadow:        files

hosts:          files dns
networks:       files

protocols:      db files
services:       db files
ethers:         db files
rpc:            db files

netgroup:       nis

```

hosts → dns

**Comment by GitEngHar** [comment]
まとめ
---

### デフォルトで作成されている仮想ネットワーク

```
PS C:\Users\haruk> docker network ls
NETWORK ID     NAME      DRIVER    SCOPE
e0c8980ef0e5   bridge    bridge    local
996365c99988   host      host      local
fe5b30842c85   none      null      local
```

`bridge` `host` `none` という3種類のネットワークがデフォルトで作成されており、各々で役割が異なる
何もnetworkを指定せずコンテナを作成した場合に適用されるのは `bridge`
 https://tinyurl.com/w9unw2v7

### 少し検証

■ networkを指定せずコンテナを作成
```
PS C:\Users\haruk> docker run --name net-issue -p 8080:80 httpd
PS C:\Users\haruk> docker ps
CONTAINER ID   IMAGE     COMMAND              CREATED          STATUS          PORTS                  NAMES
1df4887588bb   httpd     "httpd-foreground"   12 minutes ago   Up 12 minutes   0.0.0.0:8080->80/tcp   net-issue
```

■ containerが属するnetworkを確認
属するbridgeに指定がないことを確認できる
```
PS C:\Users\haruk> docker inspect container 1df4887588bb
~~省略~~
        "NetworkSettings": {
            "Bridge": "",
```

■ デフォルトのbridgeの情報を確認
デフォルトのbridgeのipが `172.17.0.1` であることがわかる
`1df4887588bb` がコンテナidであるコンテナがデフォルトブリッジのネットワークに属していることが分かる
```
PS C:\Users\haruk> docker inspect network bridge
[
            "Config": [
                {
                    "Subnet": "172.17.0.0/16",
                    "Gateway": "172.17.0.1" ### ブリッジのipアドレス
                }

        "Containers": {　### ブリッジに属するコンテナの情報
            "1df4887588bb16b2b4078c83c7ea353ee0e3b8bce00a9dcb9dbf9875edc605f6": {
                "Name": "net-issue",
                "EndpointID": "1f5b5c6c6cb656a9c4d74adfb991a3a9f7d9d459b32e4bf0d98fbb7ee9423cff",
                "MacAddress": "02:42:ac:11:00:02",
                "IPv4Address": "172.17.0.2/16",　
                "IPv6Address": ""
            }
```

■ 実際に経路を検証
windows OS → dockerをtcpdumpしてみる
localhostの8080portにパケットを転送していることしか確認できない
```
haru@TABLET-6SN5O8ET:~$ sudo tcpdump -i lo
tcpdump: verbose output suppressed, use -v or -vv for full protocol decode
listening on lo, link-type EN10MB (Ethernet), capture size 262144 bytes
21:07:40.296072 IP localhost.52350 > localhost.http-alt: Flags [S], seq 2441026603, win 65495, options [mss 65495,sackOK,TS val 657063449 ecr 0,nop,wscale 7], length 0
21:07:40.296145 IP localhost.http-alt > localhost.52350: Flags [S.], seq 540921895, ack 2441026604, win 65483, options [mss 65495,sackOK,TS val 657063449 ecr 657063449,nop,wscale 7], length 0
21:07:40.296162 IP localhost.52350 > localhost.http-alt: Flags [.], ack 1, win 512, options [nop,nop,TS val 657063449 ecr 657063449], length 0
21:07:40.297074 IP localhost.52350 > localhost.http-alt: Flags [P.], seq 1:79, ack 1, win 512, options [nop,nop,TS val 657063450 ecr 657063449], length 78: HTTP: GET / HTTP/1.1
21:07:40.297277 IP localhost.http-alt > localhost.52350: Flags [.], ack 79, win 511, options [nop,nop,TS val 657063450 ecr 657063450], length 0
21:07:40.307043 IP localhost.http-alt > localhost.52350: Flags [P.], seq 1:271, ack 79, win 512, options [nop,nop,TS val 657063460 ecr 657063450], length 270: HTTP: HTTP/1.1 200 OK
21:07:40.307130 IP localhost.52350 > localhost.http-alt: Flags [.], ack 271, win 510, options [nop,nop,TS val 657063460 ecr 657063460], length 0
21:07:40.307442 IP localhost.52350 > localhost.http-alt: Flags [F.], seq 79, ack 271, win 512, options [nop,nop,TS val 657063461 ecr 657063460], length 0
21:07:40.308480 IP localhost.http-alt > localhost.52350: Flags [F.], seq 271, ack 80, win 512, options [nop,nop,TS val 657063462 ecr 657063461], length 0
21:07:40.308585 IP localhost.52350 > localhost.http-alt: Flags [.], ack 272, win 512, options [nop,nop,TS val 657063462 ecr 657063462], length 0

```

経由となっているブリッジをdumpする
```
root@1df4887588bb:/usr/local/apache2# tcpdump -i eth0
tcpdump: verbose output suppressed, use -v[v]... for full protocol decode
listening on eth0, link-type EN10MB (Ethernet), snapshot length 262144 bytes
00:55:11.134275 IP 172.17.0.1.33892 > 1df4887588bb.80: Flags [S], seq 3602456530, win 65495, options [mss 65495,sackOK,TS val 3763696955 ecr 0,nop,wscale 7], length 0
00:55:11.134780 IP 1df4887588bb.80 > 172.17.0.1.33892: Flags [S.], seq 3113048521, ack 3602456531, win 65160, options [mss 1460,sackOK,TS val 1946618489 ecr 3763696955,nop,wscale 7], length 0
00:55:11.134885 IP 172.17.0.1.33892 > 1df4887588bb.80: Flags [.], ack 1, win 512, options [nop,nop,TS val 3763696956 ecr 1946618489], length 0
00:55:11.145568 IP 172.17.0.1.33892 > 1df4887588bb.80: Flags [P.], seq 1:79, ack 1, win 512, options [nop,nop,TS val 3763696967 ecr 1946618489], length 78: HTTP: GET / HTTP/1.1
00:55:11.145750 IP 1df4887588bb.80 > 172.17.0.1.33892: Flags [.], ack 79, win 509, options [nop,nop,TS val 1946618500 ecr 3763696967], length 0

### ここからおそらくパケットのやり取り
00:55:11.174338 IP 1df4887588bb.54355 > 192.168.70.7.53: 64303+ PTR? 1.0.17.172.in-addr.arpa. (41)
00:55:11.186965 IP 1df4887588bb.80 > 172.17.0.1.33892: Flags [P.], seq 1:271, ack 79, win 509, options [nop,nop,TS val 1946618541 ecr 3763696967], length 270: HTTP: HTTP/1.1 200 OK
00:55:11.187044 IP 172.17.0.1.33892 > 1df4887588bb.80: Flags [.], ack 271, win 510, options [nop,nop,TS val 3763697008 ecr 1946618541], length 0
00:55:11.191867 IP 172.17.0.1.33892 > 1df4887588bb.80: Flags [F.], seq 79, ack 271, win 512, options [nop,nop,TS val 3763697013 ecr 1946618541], length 0
00:55:11.192571 IP 1df4887588bb.80 > 172.17.0.1.33892: Flags [F.], seq 271, ack 80, win 509, options [nop,nop,TS val 1946618547 ecr 3763697013], length 0
00:55:11.192693 IP 172.17.0.1.33892 > 1df4887588bb.80: Flags [.], ack 272, win 512, options [nop,nop,TS val 3763697014 ecr 1946618547], length 0
00:55:11.196813 IP 192.168.70.7.53 > 1df4887588bb.54355: 64303 NXDomain 0/0/0 (41)
00:55:11.283329 IP 1df4887588bb.34091 > 192.168.70.7.53: 23064+ PTR? 7.70.168.192.in-addr.arpa. (43)
00:55:11.319401 IP 192.168.70.7.53 > 1df4887588bb.34091: 23064 NXDomain 0/0/0 (43)
```

1
■更に検証
コンテナ → windws ethernet(192.168.150.128)
```
root@1df4887588bb:/usr/local/apache2# traceroute -I -4 192.168.150.128
traceroute to 192.168.150.128 (192.168.150.128), 30 hops max, 60 byte packets
 1  172.17.0.1 (172.17.0.1)  1.324 ms  0.082 ms  0.031 ms
 2  192.168.65.5 (192.168.65.5)  0.640 ms  0.051 ms  0.020 ms
 3  192.168.150.128 (192.168.150.128)  4.949 ms  6.541 ms  8.103 ms
```

172.17.0.1：デフォルトブリッジ
192.168.65.5：不明
192.168.150.128：目的のアドレス

wsl interface( vEthernet (WSL) )であれば自然な構成に感じる

■アドレスを確認
違うように思える
```
イーサネット アダプター vEthernet (WSL):

   接続固有の DNS サフィックス . . . . .:
   リンクローカル IPv6 アドレス. . . . .: fe80::d104:84d7:7794:53d7%49
   IPv4 アドレス . . . . . . . . . . . .: 172.29.96.1
   サブネット マスク . . . . . . . . . .: 255.255.240.0
   デフォルト ゲートウェイ . . . . . . .:
```

192.168.65.5への疎通はコンテナからしか通らなかった。
network lsでdockern内のネットワークコンポーネントを調べたが他にはないので、docker 内からしかアクセスできないdockerコンポーネントではないものかと思われる。

考えられるのは、docker ネットワークとwindwosネットワークの仲介となるNAT機能。
しかし、設定を確認するに至れておらず。

### 結論

多少の疑問は残りつつ、以下結論に至る。
windwos と docker間ネットワークとしては、以下のようになると思われる。

windows host → wsl interface → docker bridge → docker container

**Comment by GitEngHar** [comment]
ネットワーク設定にて65.0を指定している

<img width="599" alt="image" src="https://user-images.githubusercontent.com/119464648/236350289-88829333-456c-40f2-8b00-12ebf3eae138.png">

ここを変更して疎通通路を確認
<img width="594" alt="image" src="https://user-images.githubusercontent.com/119464648/236350448-52104d28-933e-4ce7-ab9b-287163ba892c.png">

変わってる
```
root@1df4887588bb:/usr/local/apache2# traceroute 192.168.2.137
traceroute to 192.168.2.137 (192.168.2.137), 30 hops max, 60 byte packets
 1  172.17.0.1 (172.17.0.1)  11.105 ms  10.644 ms  10.543 ms
 2  192.168.70.5 (192.168.70.5)  10.450 ms  5.381 ms  5.256 ms
```

以下を見る限り、DockerNetworkを外部アドレス用に変換するNAT機能で変換されたアドレス
https://tinyurl.com/2s5w982w

注釈にもある通りwindows コンテナモードではwindowsがネットワークを管理するのでモードを確認
<img width="346" alt="image" src="https://user-images.githubusercontent.com/119464648/236355916-c32c3f90-9e31-487e-a0bc-788c9ddeb9ca.png">

switch でwindowsとなっているのでlinuxコンテナモードになっている

ref:コンテナモード
https://www.public.ne.jp/2020/09/09/%E3%80%90docker%E3%80%91%E7%AC%AC11%E5%9B%9E%E3%80%80windows%E3%82%B3%E3%83%B3%E3%83%86%E3%83%8A%E3%83%A2%E3%83%BC%E3%83%89%E3%81%A7iis%EF%BC%8Bclassicasp%E3%82%92%E5%8B%95%E3%81%8B%E3%81%99/

デフォルトブリッジの設定
<details>

```
haru@TABLET-6SN5O8ET:~$ docker network inspect bridge
[
    {
        "Name": "bridge",
        "Id": "57497875cf9294517f31aa24b72aeb17a8e25283f690d520a9d99ed2bfd9588d",
        "Created": "2023-05-04T23:19:51.4499926Z",
        "Scope": "local",
        "Driver": "bridge",
        "EnableIPv6": false,
        "IPAM": {
            "Driver": "default",
            "Options": null,
            "Config": [
                {
                    "Subnet": "172.17.0.0/16",
                    "Gateway": "172.17.0.1"
                }
            ]
        },
        "Internal": false,
        "Attachable": false,
        "Ingress": false,
        "ConfigFrom": {
            "Network": ""
        },
        "ConfigOnly": false,
        "Containers": {
            "1df4887588bb16b2b4078c83c7ea353ee0e3b8bce00a9dcb9dbf9875edc605f6": {
                "Name": "net-issue",
                "EndpointID": "5831afd209a15965c0a15a8f29661cbd2db11f1d82e80dd495762b59e799743c",
                "MacAddress": "02:42:ac:11:00:02",
                "IPv4Address": "172.17.0.2/16",
                "IPv6Address": ""
            }
        },
        "Options": {
            "com.docker.network.bridge.default_bridge": "true",
            "com.docker.network.bridge.enable_icc": "true",
            "com.docker.network.bridge.enable_ip_masquerade": "true",
            "com.docker.network.bridge.host_binding_ipv4": "0.0.0.0",
            "com.docker.network.bridge.name": "docker0",
            "com.docker.network.driver.mtu": "1500"
        },
        "Labels": {}
    }
]
```

</details>

ref:dockerネットワークオプション
https://docs.docker.jp/engine/reference/commandline/network_create.html#id22

default bridheログを一部抜粋

```
            "com.docker.network.bridge.default_bridge": "true",
            "com.docker.network.bridge.enable_icc": "true",
            "com.docker.network.bridge.enable_ip_masquerade": "true",
            "com.docker.network.bridge.host_binding_ipv4": "0.0.0.0",
            "com.docker.network.bridge.name": "docker0",
            "com.docker.network.driver.mtu": "1500"
```

NAPTが有効化されている
bridge → Docker NAT → Docker外ネットワーク

**Comment by GitEngHar** [comment]
docker0について

公式
https://docs.docker.jp/desktop/windows/networking.html#windows-docker0

質問サイト
https://teratail.com/questions/346944
